src/02_points_per_win/csvs/p_diff.csv

team,win_points,wins,ovr_points,p_diff,win_pct
HOU,118.3076923076923,52,115.23170731707317,3.0759849906191334,0.634
SAS,122.95161290322581,62,119.82926829268293,3.122344610542882,0.756
DEN,125.29629629629629,54,122.07317073170732,3.223125564588969,0.659
OKC,122.265625,64,119.02439024390245,3.2412347560975547,0.78
DET,121.15,60,117.76829268292683,3.381707317073179,0.732
CLE,124.03846153846153,52,119.52439024390245,4.514071294559088,0.634
MIN,123.04081632653062,49,118.0,5.040816326530617,0.598
ATL,123.52173913043478,46,118.46341463414635,5.058324496288435,0.561
NYK,121.75471698113208,53,116.45121951219512,5.303497468936953,0.646
BOS,120.44642857142857,56,114.85365853658537,5.592770034843198,0.683
CHA,121.79545454545455,44,116.01219512195122,5.783259423503324,0.537
LAL,122.62264150943396,53,116.34146341463415,6.281178094799813,0.646
PHX,118.88888888888889,45,112.58536585365853,6.303523035230356,0.549
TOR,121.02173913043478,46,114.63414634146342,6.387592788971361,0.561
ORL,122.28888888888889,45,115.7439024390244,6.544986449864496,0.549
POR,122.07142857142857,42,115.47560975609755,6.595818815331015,0.512
PHI,122.5111111111111,45,115.8780487804878,6.633062330623304,0.549
MEM,121.4,25,114.67073170731707,6.7292682926829315,0.305
LAC,120.5952380952381,42,113.76829268292683,6.826945412311275,0.512
MIA,127.76744186046511,43,120.86585365853658,6.901588201928533,0.524
GSW,121.67567567567568,37,114.60975609756098,7.065919578114702,0.451
NOP,123.88461538461539,26,115.52439024390245,8.360225140712942,0.317
WAS,121.47058823529412,17,112.90243902439025,8.568149210903869,0.207
CHI,125.0,31,116.3048780487805,8.695121951219505,0.378
IND,121.21052631578948,19,112.42682926829268,8.783697047496801,0.232
DAL,122.92307692307692,26,114.1219512195122,8.801125703564722,0.317
SAC,121.04545454545455,22,111.0,10.045454545454547,0.268
MIL,120.90625,32,110.63414634146342,10.27210365853658,0.39
BKN,116.3,20,105.92682926829268,10.373170731707319,0.244
UTA,128.86363636363637,22,117.58536585365853,11.278270509977844,0.268

src/02_points_per_win/README.md

## Utah's Win Performance

The Utah Jazz didn't win often throughout the season. But out of the games the Jazz won, there were several games where both teams scored very high. This indicates that the Jazz tended to sacrafice defense in order to produce high-scoring offense to win. This is likely the reason why the Jazz averaged the highest points per win (128.9 per game) in the league and why their win average and overall average had the largest difference in the league (11.3 points). It's not sustainable to maintain such a high offensive output for an entire season, which is likely why the Jazz had a poor win percentage.

## Brooklyn's Win Performance

The Brooklyn Nets had the second highest point differential between points per win and overall points per game (10.4 points). Although the Nets find a way to produce a personal higher than normal offensive efficiency, they averaged the lowest points per win average (116.3 points) and had the leagues worst overall points per game average (105.9). The Nets were the only team to average less than 110 points per game. The Nets' peak offense couldn't rival the league's elite, as their average points per win lagged behind a third of the NBA. Altought victories were sparse, the Nets were able to make up for their lack of offensive output with their defensive performance. In one of their best defensive performace, the Nets managed to smother their opponents with holding them to less than 90 points while scoring an uncharacteristically high 127 points. Unfortunately, the Nets could not make strong defense a regular occurance. They ended the season with only 20 wins, third worst in the league.